{
  "$schema": "https://json-schema.org/draft/2020-12/schema",
  "title": "OFDM benchmark configuration",
  "description": "Fixed main-profile geometry; see README.md for semantic constraints that JSON Schema cannot express. M8 freezes main-profile perf.n_batches at 2048. Null remains allowed in an uncalibrated derived configuration and is rejected in perf mode.",
  "type": "object",
  "additionalProperties": false,
  "required": [
    "schema_version",
    "profile_id",
    "N_fft",
    "N_cp",
    "M",
    "active_bins",
    "pilot_bins",
    "data_bins",
    "pilots",
    "pdp",
    "E_sym",
    "bits_per_symbol",
    "B",
    "warmup_batches",
    "master_seed",
    "channel",
    "csi",
    "ber",
    "perf",
    "stages"
  ],
  "properties": {
    "schema_version": {
      "const": 1,
      "type": "integer"
    },
    "profile_id": {
      "const": "ofdm_16qam_main_v1",
      "type": "string"
    },
    "N_fft": {
      "const": 256,
      "type": "integer"
    },
    "N_cp": {
      "const": 32,
      "type": "integer"
    },
    "M": {
      "const": 16,
      "type": "integer"
    },
    "active_bins": {
      "const": [
        -96,
        -95,
        -94,
        -93,
        -92,
        -91,
        -90,
        -89,
        -88,
        -87,
        -86,
        -85,
        -84,
        -83,
        -82,
        -81,
        -80,
        -79,
        -78,
        -77,
        -76,
        -75,
        -74,
        -73,
        -72,
        -71,
        -70,
        -69,
        -68,
        -67,
        -66,
        -65,
        -64,
        -63,
        -62,
        -61,
        -60,
        -59,
        -58,
        -57,
        -56,
        -55,
        -54,
        -53,
        -52,
        -51,
        -50,
        -49,
        -48,
        -47,
        -46,
        -45,
        -44,
        -43,
        -42,
        -41,
        -40,
        -39,
        -38,
        -37,
        -36,
        -35,
        -34,
        -33,
        -32,
        -31,
        -30,
        -29,
        -28,
        -27,
        -26,
        -25,
        -24,
        -23,
        -22,
        -21,
        -20,
        -19,
        -18,
        -17,
        -16,
        -15,
        -14,
        -13,
        -12,
        -11,
        -10,
        -9,
        -8,
        -7,
        -6,
        -5,
        -4,
        -3,
        -2,
        -1,
        1,
        2,
        3,
        4,
        5,
        6,
        7,
        8,
        9,
        10,
        11,
        12,
        13,
        14,
        15,
        16,
        17,
        18,
        19,
        20,
        21,
        22,
        23,
        24,
        25,
        26,
        27,
        28,
        29,
        30,
        31,
        32,
        33,
        34,
        35,
        36,
        37,
        38,
        39,
        40,
        41,
        42,
        43,
        44,
        45,
        46,
        47,
        48,
        49,
        50,
        51,
        52,
        53,
        54,
        55,
        56,
        57,
        58,
        59,
        60,
        61,
        62,
        63,
        64,
        65,
        66,
        67,
        68,
        69,
        70,
        71,
        72,
        73,
        74,
        75,
        76,
        77,
        78,
        79,
        80,
        81,
        82,
        83,
        84,
        85,
        86,
        87,
        88,
        89,
        90,
        91,
        92,
        93,
        94,
        95,
        96
      ],
      "type": "array"
    },
    "pilot_bins": {
      "const": [
        -96,
        -88,
        -80,
        -72,
        -64,
        -56,
        -48,
        -40,
        -32,
        -24,
        -16,
        -8,
        8,
        16,
        24,
        32,
        40,
        48,
        56,
        64,
        72,
        80,
        88,
        96
      ],
      "type": "array"
    },
    "data_bins": {
      "const": [
        -95,
        -94,
        -93,
        -92,
        -91,
        -90,
        -89,
        -87,
        -86,
        -85,
        -84,
        -83,
        -82,
        -81,
        -79,
        -78,
        -77,
        -76,
        -75,
        -74,
        -73,
        -71,
        -70,
        -69,
        -68,
        -67,
        -66,
        -65,
        -63,
        -62,
        -61,
        -60,
        -59,
        -58,
        -57,
        -55,
        -54,
        -53,
        -52,
        -51,
        -50,
        -49,
        -47,
        -46,
        -45,
        -44,
        -43,
        -42,
        -41,
        -39,
        -38,
        -37,
        -36,
        -35,
        -34,
        -33,
        -31,
        -30,
        -29,
        -28,
        -27,
        -26,
        -25,
        -23,
        -22,
        -21,
        -20,
        -19,
        -18,
        -17,
        -15,
        -14,
        -13,
        -12,
        -11,
        -10,
        -9,
        -7,
        -6,
        -5,
        -4,
        -3,
        -2,
        -1,
        1,
        2,
        3,
        4,
        5,
        6,
        7,
        9,
        10,
        11,
        12,
        13,
        14,
        15,
        17,
        18,
        19,
        20,
        21,
        22,
        23,
        25,
        26,
        27,
        28,
        29,
        30,
        31,
        33,
        34,
        35,
        36,
        37,
        38,
        39,
        41,
        42,
        43,
        44,
        45,
        46,
        47,
        49,
        50,
        51,
        52,
        53,
        54,
        55,
        57,
        58,
        59,
        60,
        61,
        62,
        63,
        65,
        66,
        67,
        68,
        69,
        70,
        71,
        73,
        74,
        75,
        76,
        77,
        78,
        79,
        81,
        82,
        83,
        84,
        85,
        86,
        87,
        89,
        90,
        91,
        92,
        93,
        94,
        95
      ],
      "type": "array"
    },
    "pilots": {
      "const": [
        1,
        -1,
        1,
        1,
        -1,
        -1,
        1,
        -1,
        -1,
        1,
        1,
        -1,
        -1,
        1,
        -1,
        -1,
        1,
        1,
        -1,
        1,
        1,
        -1,
        -1,
        1
      ],
      "type": "array"
    },
    "pdp": {
      "const": [
        0.4008104395612044,
        0.2431038203267679,
        0.14744992052145603,
        0.08943289756845409,
        0.05424379436220683,
        0.032900524379825734,
        0.019955176756987283,
        0.012103426523097705
      ],
      "type": "array"
    },
    "E_sym": {
      "const": 216,
      "type": "integer"
    },
    "bits_per_symbol": {
      "const": 672,
      "type": "integer"
    },
    "B": {
      "const": 256,
      "type": "integer"
    },
    "warmup_batches": {
      "const": 4,
      "type": "integer"
    },
    "master_seed": {
      "type": "integer",
      "minimum": 0,
      "maximum": 18446744073709551615
    },
    "channel": {
      "enum": [
        "rayleigh",
        "awgn"
      ]
    },
    "csi": {
      "enum": [
        "estimated",
        "perfect"
      ]
    },
    "ber": {
      "type": "object",
      "additionalProperties": false,
      "required": [
        "target_errors",
        "min_batches",
        "max_bits",
        "ebn0_db"
      ],
      "properties": {
        "target_errors": {
          "type": "integer",
          "minimum": 1,
          "maximum": 18446744073709551615
        },
        "min_batches": {
          "type": "integer",
          "minimum": 1,
          "maximum": 18446744073709551615
        },
        "max_bits": {
          "type": "integer",
          "minimum": 1,
          "maximum": 18446744073709551615
        },
        "ebn0_db": {
          "type": "array",
          "minItems": 1,
          "items": {
            "type": "number"
          }
        }
      }
    },
    "perf": {
      "type": "object",
      "additionalProperties": false,
      "required": [
        "ebn0_db",
        "n_batches"
      ],
      "properties": {
        "ebn0_db": {
          "type": "integer",
          "const": 10
        },
        "n_batches": {
          "anyOf": [
            {
              "type": "null"
            },
            {
              "type": "integer",
              "minimum": 1,
              "maximum": 107228562556440
            }
          ]
        }
      }
    },
    "stages": {
      "type": "object",
      "additionalProperties": false,
      "required": [
        "repetitions"
      ],
      "properties": {
        "repetitions": {
          "type": "integer",
          "minimum": 1,
          "maximum": 18446744073709551615
        }
      }
    }
  }
}
