{
  "schema_version": 1,
  "profile_id": "ofdm_16qam_main_v1",
  "N_fft": 256,
  "N_cp": 32,
  "M": 16,
  "active_bins": [
    -96,
    -95,
    -94,
    -93,
    -92,
    -91,
    -90,
    -89,
    -88,
    -87,
    -86,
    -85,
    -84,
    -83,
    -82,
    -81,
    -80,
    -79,
    -78,
    -77,
    -76,
    -75,
    -74,
    -73,
    -72,
    -71,
    -70,
    -69,
    -68,
    -67,
    -66,
    -65,
    -64,
    -63,
    -62,
    -61,
    -60,
    -59,
    -58,
    -57,
    -56,
    -55,
    -54,
    -53,
    -52,
    -51,
    -50,
    -49,
    -48,
    -47,
    -46,
    -45,
    -44,
    -43,
    -42,
    -41,
    -40,
    -39,
    -38,
    -37,
    -36,
    -35,
    -34,
    -33,
    -32,
    -31,
    -30,
    -29,
    -28,
    -27,
    -26,
    -25,
    -24,
    -23,
    -22,
    -21,
    -20,
    -19,
    -18,
    -17,
    -16,
    -15,
    -14,
    -13,
    -12,
    -11,
    -10,
    -9,
    -8,
    -7,
    -6,
    -5,
    -4,
    -3,
    -2,
    -1,
    1,
    2,
    3,
    4,
    5,
    6,
    7,
    8,
    9,
    10,
    11,
    12,
    13,
    14,
    15,
    16,
    17,
    18,
    19,
    20,
    21,
    22,
    23,
    24,
    25,
    26,
    27,
    28,
    29,
    30,
    31,
    32,
    33,
    34,
    35,
    36,
    37,
    38,
    39,
    40,
    41,
    42,
    43,
    44,
    45,
    46,
    47,
    48,
    49,
    50,
    51,
    52,
    53,
    54,
    55,
    56,
    57,
    58,
    59,
    60,
    61,
    62,
    63,
    64,
    65,
    66,
    67,
    68,
    69,
    70,
    71,
    72,
    73,
    74,
    75,
    76,
    77,
    78,
    79,
    80,
    81,
    82,
    83,
    84,
    85,
    86,
    87,
    88,
    89,
    90,
    91,
    92,
    93,
    94,
    95,
    96
  ],
  "pilot_bins": [
    -96,
    -88,
    -80,
    -72,
    -64,
    -56,
    -48,
    -40,
    -32,
    -24,
    -16,
    -8,
    8,
    16,
    24,
    32,
    40,
    48,
    56,
    64,
    72,
    80,
    88,
    96
  ],
  "data_bins": [
    -95,
    -94,
    -93,
    -92,
    -91,
    -90,
    -89,
    -87,
    -86,
    -85,
    -84,
    -83,
    -82,
    -81,
    -79,
    -78,
    -77,
    -76,
    -75,
    -74,
    -73,
    -71,
    -70,
    -69,
    -68,
    -67,
    -66,
    -65,
    -63,
    -62,
    -61,
    -60,
    -59,
    -58,
    -57,
    -55,
    -54,
    -53,
    -52,
    -51,
    -50,
    -49,
    -47,
    -46,
    -45,
    -44,
    -43,
    -42,
    -41,
    -39,
    -38,
    -37,
    -36,
    -35,
    -34,
    -33,
    -31,
    -30,
    -29,
    -28,
    -27,
    -26,
    -25,
    -23,
    -22,
    -21,
    -20,
    -19,
    -18,
    -17,
    -15,
    -14,
    -13,
    -12,
    -11,
    -10,
    -9,
    -7,
    -6,
    -5,
    -4,
    -3,
    -2,
    -1,
    1,
    2,
    3,
    4,
    5,
    6,
    7,
    9,
    10,
    11,
    12,
    13,
    14,
    15,
    17,
    18,
    19,
    20,
    21,
    22,
    23,
    25,
    26,
    27,
    28,
    29,
    30,
    31,
    33,
    34,
    35,
    36,
    37,
    38,
    39,
    41,
    42,
    43,
    44,
    45,
    46,
    47,
    49,
    50,
    51,
    52,
    53,
    54,
    55,
    57,
    58,
    59,
    60,
    61,
    62,
    63,
    65,
    66,
    67,
    68,
    69,
    70,
    71,
    73,
    74,
    75,
    76,
    77,
    78,
    79,
    81,
    82,
    83,
    84,
    85,
    86,
    87,
    89,
    90,
    91,
    92,
    93,
    94,
    95
  ],
  "pilots": [
    1,
    -1,
    1,
    1,
    -1,
    -1,
    1,
    -1,
    -1,
    1,
    1,
    -1,
    -1,
    1,
    -1,
    -1,
    1,
    1,
    -1,
    1,
    1,
    -1,
    -1,
    1
  ],
  "pdp": [
    0.40081043956120438,
    0.24310382032676789,
    0.14744992052145603,
    0.089432897568454087,
    0.054243794362206832,
    0.032900524379825734,
    0.019955176756987283,
    0.012103426523097705
  ],
  "E_sym": 216,
  "bits_per_symbol": 672,
  "B": 256,
  "warmup_batches": 4,
  "master_seed": 20260930,
  "channel": "rayleigh",
  "csi": "estimated",
  "ber": {
    "target_errors": 1000,
    "min_batches": 32,
    "max_bits": 1000000000,
    "ebn0_db": [
      0,
      2,
      4,
      6,
      8,
      10,
      12,
      14,
      16,
      18,
      20,
      22,
      24,
      26,
      28,
      30
    ]
  },
  "perf": {
    "ebn0_db": 10,
    "n_batches": null
  },
  "stages": {
    "repetitions": 100
  }
}
